{
  "schema_version": "eval-execution-profile/v1",
  "id": "handoff-receiver-confirmation-sonnet",
  "comparison": {
    "id": "handoff-receiver-confirmation-sonnet",
    "models": {
      "claude-plugin": "sonnet",
      "codex-cli": "not-run"
    }
  },
  "engine": "claude-plugin",
  "claims": [
    "behavioral_contract",
    "deterministic_grader_result",
    "native_component_invoked"
  ],
  "scenario_ids": [
    "agent-direct-handoff-sre-recommend-only",
    "agent-direct-handoff-software-engineer-blocks-unapproved",
    "agent-direct-handoff-scribe-blocks-unapproved"
  ],
  "required_references": {},
  "model": "sonnet",
  "trials": 3,
  "timeout_s": 300,
  "total_timeout_s": 3600,
  "cost_budget": {
    "status": "available",
    "max_usd": 4
  },
  "approval": null
}
