{
  "schema_version": "eval-execution-profile/v1",
  "id": "handoff-one-click-sonnet",
  "comparison": {
    "id": "handoff-one-click-sonnet",
    "models": {
      "claude-plugin": "sonnet",
      "codex-cli": "not-run"
    }
  },
  "engine": "claude-plugin",
  "claims": [
    "behavioral_contract",
    "deterministic_grader_result",
    "native_component_invoked"
  ],
  "scenario_ids": [
    "agent-direct-handoff-sre-recommend-only",
    "agent-direct-handoff-software-engineer-blocks-unapproved",
    "agent-direct-handoff-scribe-blocks-unapproved",
    "agent-direct-reviewer-authz-block"
  ],
  "required_references": {},
  "model": "sonnet",
  "trials": 5,
  "timeout_s": 300,
  "total_timeout_s": 7200,
  "cost_budget": {
    "status": "available",
    "max_usd": 8
  },
  "approval": {
    "approved_by": "latent-sre",
    "approved_at": "2026-08-30T06:29:31Z",
    "budget_id": "handoff-one-click-sonnet-2026-08-30"
  }
}
