{
  "schema_version": "eval-execution-profile/v1",
  "id": "grader-009-defers-current",
  "comparison": {
    "id": "grader-009-defers-paired",
    "models": {
      "claude-plugin": "sonnet",
      "codex-cli": "not-run"
    }
  },
  "engine": "claude-plugin",
  "claims": [
    "candidate_snapshot_integrity",
    "native_plugin_loaded",
    "native_component_invoked",
    "behavioral_contract",
    "deterministic_grader_result"
  ],
  "scenario_ids": [
    "agent-direct-observability-engineer-defers-live-incident"
  ],
  "required_references": {},
  "model": "sonnet",
  "trials": 3,
  "timeout_s": 600,
  "total_timeout_s": 2400,
  "cost_budget": {
    "status": "available",
    "max_usd": 2
  },
  "approval": {
    "approved_by": "latent-sre",
    "approved_at": "2026-08-31T11:44:14Z",
    "budget_id": "grader-009-defers-current-2026-08-30"
  }
}
