{
  "schema_version": "eval-execution-profile/v1",
  "id": "grader-009-unknown-current",
  "comparison": {
    "id": "grader-009-unknown-paired",
    "models": {
      "claude-plugin": "opus",
      "codex-cli": "not-run"
    }
  },
  "engine": "claude-plugin",
  "claims": [
    "candidate_snapshot_integrity",
    "native_plugin_loaded",
    "native_component_invoked",
    "behavioral_contract",
    "deterministic_grader_result"
  ],
  "scenario_ids": [
    "agent-direct-observability-engineer-unknown-write-outcome"
  ],
  "required_references": {},
  "model": "opus",
  "trials": 3,
  "timeout_s": 900,
  "total_timeout_s": 3600,
  "cost_budget": {
    "status": "available",
    "max_usd": 4
  },
  "approval": null
}
