{
  "schema_version": "eval-execution-profile/v1",
  "id": "eval-004-incident-guidance-references",
  "comparison": {
    "id": "eval-004-incident-guidance-references",
    "models": {
      "claude-plugin": "sonnet",
      "codex-cli": "not-run"
    }
  },
  "engine": "claude-plugin",
  "claims": [
    "behavioral_contract",
    "deterministic_grader_result",
    "reference_used",
    "native_component_invoked"
  ],
  "scenario_ids": [
    "incident-command-perishable-evidence-contract",
    "investigation-depth-flat-signals-are-not-health"
  ],
  "required_references": {
    "incident-command-perishable-evidence-contract": [
      "skills/incident-command/references/mitigation-selection.md"
    ],
    "investigation-depth-flat-signals-are-not-health": [
      "skills/investigation-depth/references/signal-characterization.md"
    ]
  },
  "model": "sonnet",
  "trials": 3,
  "timeout_s": 600,
  "total_timeout_s": 7200,
  "cost_budget": {
    "status": "available",
    "max_usd": 4
  },
  "approval": null
}
