{
  "schema_version": "eval-execution-profile/v1",
  "id": "route-005-incident-investigation-candidate",
  "comparison": {
    "id": "route-005-incident-investigation-paired",
    "models": {
      "claude-plugin": "sonnet",
      "codex-cli": "not-run"
    }
  },
  "engine": "claude-plugin",
  "claims": [
    "candidate_snapshot_integrity",
    "native_plugin_loaded",
    "native_component_invoked",
    "behavioral_contract",
    "deterministic_grader_result"
  ],
  "scenario_ids": [
    "discovery-incident-investigation-first-response",
    "discovery-incident-investigation-systemic-failure",
    "discovery-incident-investigation-defers-engineering-altitude"
  ],
  "required_references": {},
  "model": "sonnet",
  "trials": 3,
  "timeout_s": 600,
  "total_timeout_s": 7200,
  "cost_budget": {
    "status": "available",
    "max_usd": 4
  },
  "approval": {
    "approved_by": "Save Toolkit maintainers",
    "approved_at": "2026-08-30T14:59:21Z",
    "budget_id": "route-005-incident-investigation-candidate-2026-08-30"
  }
}
